"DESCRIPTION","DURATION IN MS","NAME","PARENT SUITE","START TIME","STATUS","STOP TIME","SUB SUITE","SUITE","TEST CLASS","TEST METHOD"
"","15382","Checkout with empty form fields","Checkout Process","2026-03-26","failed","2026-03-26","","","",""
"","15681","Complete a full purchase","Checkout Process","2026-03-26","failed","2026-03-26","","","",""
"","15365","Verify order completion and return home","Checkout Process","2026-03-26","failed","2026-03-26","","","",""
"","16452","Add a single item to the cart","Shopping Cart","2026-03-26","failed","2026-03-26","","","",""
"","15701","Successful login with valid credentials","Login to SauceDemo","2026-03-26","failed","2026-03-26","","","",""
"","396","Failed login with invalid credentials","Login to SauceDemo","2026-03-26","failed","2026-03-26","","","",""
